{
  "schema_version": "2.0",
  "source_notes": [
    "Windows Package Manager and winget configuration: Microsoft Learn",
    "WSL installation and distro management: Microsoft Learn",
    ".NET SDK and WPF target framework support: Microsoft Learn",
    "Android Studio, Android SDK, platform-tools, and emulator detection: Android Developers",
    "Tool package IDs validated against winget data where practical; source notes are informational, not claims of popularity."
  ],
  "best_dev_stack": [
    "powershell7",
    "windows-terminal",
    "git",
    "github-cli",
    "git-lfs",
    "vscode",
    "dotnet-sdk",
    "python3",
    "py-launcher",
    "pip",
    "pipx",
    "uv",
    "nodejs-lts",
    "npm",
    "pnpm",
    "java-jdk",
    "7zip",
    "ripgrep",
    "fd",
    "jq",
    "yq",
    "vs-build-tools",
    "pre-commit",
    "ruff",
    "pytest",
    "mypy",
    "typescript",
    "eslint",
    "prettier",
    "dotnet-format"
  ],
  "tools": [
    {
      "tool_id": "winget",
      "display_name": "Windows Package Manager",
      "category": "System Core",
      "description": "Microsoft's package manager for Windows apps and developer tools.",
      "why_it_matters": "It is the safest default installer and updater for this dashboard.",
      "used_for": ["installing tools", "checking updates", "repeatable setup"],
      "install_method": "builtin",
      "install_tier": "Core",
      "is_heavy": false,
      "importance_score": 100,
      "goal_tags": ["all", "ai_codex_ready", "windows_cli_scripting"],
      "winget_ids": [],
      "fallback_urls": ["https://apps.microsoft.com/detail/9nblggh4nns1"],
      "detection": {
        "executables": ["winget.exe"],
        "common_paths": ["%LOCALAPPDATA%\\Microsoft\\WindowsApps\\winget.exe"],
        "registry_patterns": ["App Installer"],
        "version_commands": [{ "executable": "winget.exe", "arguments": ["--version"] }],
        "env_vars": [],
        "winget_names": ["App Installer"]
      }
    },
    {
      "tool_id": "powershell7",
      "display_name": "PowerShell 7",
      "category": "System Core",
      "description": "Modern cross-platform PowerShell runtime.",
      "why_it_matters": "It gives scripts a current shell with better module and automation support.",
      "used_for": ["automation", "scripting", "cross-platform dev"],
      "install_method": "winget",
      "install_tier": "Core",
      "is_heavy": false,
      "importance_score": 96,
      "goal_tags": ["all", "windows_cli_scripting", "python_automation", "linux_crossplatform", "ai_codex_ready"],
      "winget_ids": ["Microsoft.PowerShell"],
      "fallback_urls": ["https://github.com/PowerShell/PowerShell/releases/latest"],
      "detection": {
        "executables": ["pwsh.exe"],
        "common_paths": ["%ProgramFiles%\\PowerShell\\7\\pwsh.exe"],
        "registry_patterns": ["PowerShell"],
        "version_commands": [{ "executable": "pwsh.exe", "arguments": ["--version"] }],
        "env_vars": [],
        "winget_names": ["PowerShell"]
      }
    },
    {
      "tool_id": "windows-terminal",
      "display_name": "Windows Terminal",
      "category": "System Core",
      "description": "Modern terminal host for PowerShell, WSL, Git, and developer shells.",
      "why_it_matters": "It keeps Windows, Linux, and cloud shells usable in one place.",
      "used_for": ["terminal workflows", "WSL", "PowerShell"],
      "install_method": "winget",
      "install_tier": "Recommended",
      "is_heavy": false,
      "importance_score": 88,
      "goal_tags": ["all", "linux_crossplatform", "windows_cli_scripting"],
      "winget_ids": ["Microsoft.WindowsTerminal"],
      "fallback_urls": ["https://apps.microsoft.com/detail/9n0dx20hk701"],
      "detection": {
        "executables": ["wt.exe"],
        "common_paths": ["%LOCALAPPDATA%\\Microsoft\\WindowsApps\\wt.exe"],
        "registry_patterns": ["Windows Terminal"],
        "version_commands": [{ "executable": "wt.exe", "arguments": ["--version"] }],
        "env_vars": [],
        "winget_names": ["Windows Terminal"]
      }
    },
    {
      "tool_id": "git",
      "display_name": "Git",
      "category": "System Core",
      "description": "Distributed version control system.",
      "why_it_matters": "Git is required for source control, open-source workflows, and most scaffolding tools.",
      "used_for": ["version control", "GitHub", "project setup"],
      "install_method": "winget",
      "install_tier": "Core",
      "is_heavy": false,
      "importance_score": 100,
      "goal_tags": ["all", "github_open_source", "ai_codex_ready"],
      "winget_ids": ["Git.Git"],
      "fallback_urls": ["https://git-scm.com/download/win"],
      "detection": {
        "executables": ["git.exe"],
        "common_paths": ["%ProgramFiles%\\Git\\cmd\\git.exe", "%ProgramFiles%\\Git\\bin\\git.exe"],
        "registry_patterns": ["Git"],
        "version_commands": [{ "executable": "git.exe", "arguments": ["--version"] }],
        "env_vars": [],
        "winget_names": ["Git"]
      }
    },
    {
      "tool_id": "github-cli",
      "display_name": "GitHub CLI",
      "category": "GitHub Workflow",
      "description": "Command-line interface for GitHub repositories, pull requests, auth, and workflows.",
      "why_it_matters": "It enables secure GitHub auth, PR workflows, issue work, and Codespaces-style automation without storing tokens here.",
      "used_for": ["GitHub auth", "pull requests", "issues", "actions"],
      "install_method": "winget",
      "install_tier": "Core",
      "is_heavy": false,
      "importance_score": 94,
      "goal_tags": ["all", "github_open_source", "ai_codex_ready"],
      "winget_ids": ["GitHub.cli"],
      "fallback_urls": ["https://github.com/cli/cli/releases/latest"],
      "detection": {
        "executables": ["gh.exe"],
        "common_paths": ["%ProgramFiles%\\GitHub CLI\\gh.exe"],
        "registry_patterns": ["GitHub CLI"],
        "version_commands": [{ "executable": "gh.exe", "arguments": ["--version"] }],
        "env_vars": [],
        "winget_names": ["GitHub CLI"]
      }
    },
    {
      "tool_id": "git-lfs",
      "display_name": "Git LFS",
      "category": "GitHub Workflow",
      "description": "Large file support for Git repositories.",
      "why_it_matters": "Useful for assets, binaries, models, game tools, and repositories with large files.",
      "used_for": ["large repository files", "assets", "models"],
      "install_method": "winget",
      "install_tier": "Recommended",
      "is_heavy": false,
      "importance_score": 72,
      "goal_tags": ["github_open_source", "game_tools_modding", "ai_codex_ready"],
      "winget_ids": ["GitHub.GitLFS"],
      "fallback_urls": ["https://git-lfs.com/"],
      "detection": {
        "executables": ["git-lfs.exe"],
        "common_paths": ["%ProgramFiles%\\Git LFS\\git-lfs.exe", "%ProgramFiles%\\Git\\mingw64\\bin\\git-lfs.exe"],
        "registry_patterns": ["Git LFS"],
        "version_commands": [{ "executable": "git-lfs.exe", "arguments": ["version"] }],
        "env_vars": [],
        "winget_names": ["Git LFS"]
      }
    },
    {
      "tool_id": "vscode",
      "display_name": "Visual Studio Code",
      "category": "System Core",
      "description": "Lightweight editor for most languages and GitHub workflows.",
      "why_it_matters": "It is the most broadly useful editor for scripts, apps, APIs, WSL, and AI-assisted coding.",
      "used_for": ["editing", "debugging", "extensions", "GitHub"],
      "install_method": "winget",
      "install_tier": "Core",
      "is_heavy": false,
      "importance_score": 98,
      "goal_tags": ["all", "ai_codex_ready"],
      "winget_ids": ["Microsoft.VisualStudioCode"],
      "fallback_urls": ["https://code.visualstudio.com/Download"],
      "detection": {
        "executables": ["code.cmd", "code.exe"],
        "common_paths": ["%LOCALAPPDATA%\\Programs\\Microsoft VS Code\\bin\\code.cmd", "%ProgramFiles%\\Microsoft VS Code\\bin\\code.cmd"],
        "registry_patterns": ["Visual Studio Code"],
        "version_commands": [{ "executable": "code.cmd", "arguments": ["--version"] }],
        "env_vars": [],
        "winget_names": ["Microsoft Visual Studio Code", "Visual Studio Code"]
      }
    },
    {
      "tool_id": "vs-build-tools",
      "display_name": "Visual Studio Build Tools",
      "category": ".NET / C#",
      "description": "Microsoft build toolchain for native and .NET projects.",
      "why_it_matters": "Needed for C++ build dependencies, Windows desktop app builds, NuGet packages with native code, and some Python packaging.",
      "used_for": ["C++ build chain", "MSBuild", "Windows desktop apps", "native dependencies"],
      "install_method": "winget",
      "install_tier": "Recommended",
      "is_heavy": true,
      "importance_score": 82,
      "goal_tags": ["windows_desktop", "dotnet_csharp", "ai_codex_ready", "everything"],
      "winget_ids": ["Microsoft.VisualStudio.BuildTools", "Microsoft.VisualStudio.2022.BuildTools"],
      "fallback_urls": ["https://visualstudio.microsoft.com/downloads/#build-tools-for-visual-studio"],
      "detection": {
        "executables": ["MSBuild.exe"],
        "common_paths": ["%ProgramFiles%\\Microsoft Visual Studio\\2026\\BuildTools\\MSBuild\\Current\\Bin\\MSBuild.exe", "%ProgramFiles(x86)%\\Microsoft Visual Studio\\2026\\BuildTools\\MSBuild\\Current\\Bin\\MSBuild.exe", "%ProgramFiles%\\Microsoft Visual Studio\\2022\\BuildTools\\MSBuild\\Current\\Bin\\MSBuild.exe", "%ProgramFiles(x86)%\\Microsoft Visual Studio\\2022\\BuildTools\\MSBuild\\Current\\Bin\\MSBuild.exe"],
        "registry_patterns": ["Visual Studio BuildTools", "Visual Studio Build Tools"],
        "version_commands": [{ "executable": "MSBuild.exe", "arguments": ["-version"] }],
        "env_vars": [],
        "winget_names": ["Visual Studio BuildTools", "Visual Studio Build Tools"]
      }
    },
    {
      "tool_id": "dotnet-sdk",
      "display_name": ".NET SDK",